{
  "user_id": "teste_bootstrap",
  "display_name": "Teste Bootstrap",
  "version": "1.0",
  "created_at": "2026-03-22T08:55:31.979150+00:00",
  "updated_at": "2026-03-22T08:55:31.979150+00:00",
  "identity_base": {
    "primary_language": "pt-BR",
    "timezone": "Europe/London",
    "role_profile": "creator",
    "technical_level": "intermediate"
  },
  "interaction_profile": {
    "preferred_tone": "direct",
    "response_depth": "balanced",
    "step_by_step": true,
    "correction_style": "mixed"
  },
  "accessibility_profile": {
    "needs_adaptation": false,
    "visual_support": false,
    "motor_support": false,
    "fatigue_support": false,
    "notes": ""
  },
  "governance": {
    "recognition_required": true,
    "allow_capsules_on_transition_only": true,
    "sci_is_stable": true
  }
}